{
  "schemaVersion": "1.0.0",
  "packId": "HODIE-EXPANSION-2026-01",
  "title": "CEFR expansion pack 01",
  "description": "Large vocabulary and communicative-function expansion plus planned grammar roadmap. Draft rules are not active until implementation and contrastive tests pass.",
  "communicativeFunctions": [
    {
      "id": "GIVE_DAILY_ROUTINE",
      "level": "A1-A2",
      "canDoIds": [
        "LI-A2-03"
      ],
      "label": "Describe your daily routine",
      "labelEs": "Describir tu rutina diaria",
      "skills": [
        "speaking",
        "listening",
        "interaction",
        "writing"
      ],
      "structures": [
        "present-simple",
        "frequency-adverbs",
        "time-expressions"
      ],
      "vocabularyDomains": [
        "daily-life",
        "time",
        "work"
      ],
      "contexts": [
        "personal",
        "professional"
      ]
    },
    {
      "id": "TALK_ABOUT_FAMILY",
      "level": "A1",
      "canDoIds": [
        "LI-A2-04"
      ],
      "label": "Talk about family and relationships",
      "labelEs": "Hablar de la familia y las relaciones",
      "skills": [
        "speaking",
        "listening",
        "interaction"
      ],
      "structures": [
        "be",
        "have",
        "possessive-adjectives",
        "family-nouns"
      ],
      "vocabularyDomains": [
        "family",
        "identity"
      ],
      "contexts": [
        "personal",
        "professional"
      ]
    },
    {
      "id": "DESCRIBE_PLACES",
      "level": "A1-A2",
      "canDoIds": [
        "LI-A2-05"
      ],
      "label": "Describe familiar places",
      "labelEs": "Describir lugares conocidos",
      "skills": [
        "speaking",
        "listening",
        "interaction"
      ],
      "structures": [
        "there-is-are",
        "prepositions-of-place",
        "adjectives"
      ],
      "vocabularyDomains": [
        "places",
        "description"
      ],
      "contexts": [
        "personal",
        "professional"
      ]
    },
    {
      "id": "ASK_FOR_DIRECTIONS",
      "level": "A2",
      "canDoIds": [
        "LI-A2-06"
      ],
      "label": "Ask for and give directions",
      "labelEs": "Preguntar y dar indicaciones",
      "skills": [
        "speaking",
        "listening",
        "interaction",
        "writing"
      ],
      "structures": [
        "imperatives",
        "prepositions-of-place",
        "polite-questions"
      ],
      "vocabularyDomains": [
        "places",
        "travel"
      ],
      "contexts": [
        "personal",
        "professional"
      ]
    },
    {
      "id": "MAKE_REQUESTS",
      "level": "A2",
      "canDoIds": [
        "LI-A2-07"
      ],
      "label": "Make polite requests",
      "labelEs": "Hacer solicitudes corteses",
      "skills": [
        "speaking",
        "listening",
        "interaction"
      ],
      "structures": [
        "can-could",
        "polite-questions",
        "please-thank-you"
      ],
      "vocabularyDomains": [
        "communication",
        "daily-life"
      ],
      "contexts": [
        "personal",
        "professional"
      ]
    },
    {
      "id": "OFFER_HELP",
      "level": "A2",
      "canDoIds": [
        "LI-A2-08"
      ],
      "label": "Offer and respond to help",
      "labelEs": "Ofrecer ayuda y responder",
      "skills": [
        "speaking",
        "listening",
        "interaction"
      ],
      "structures": [
        "can-could",
        "would-like",
        "interaction-strategies"
      ],
      "vocabularyDomains": [
        "communication",
        "work"
      ],
      "contexts": [
        "personal",
        "professional"
      ]
    },
    {
      "id": "TALK_ABOUT_PREFERENCES",
      "level": "A2",
      "canDoIds": [
        "LI-A2-09"
      ],
      "label": "Express preferences and explain choices",
      "labelEs": "Expresar preferencias y explicar elecciones",
      "skills": [
        "speaking",
        "listening",
        "interaction",
        "writing"
      ],
      "structures": [
        "prefer",
        "like-love-enjoy",
        "because-so-but"
      ],
      "vocabularyDomains": [
        "preferences",
        "opinions",
        "learning"
      ],
      "contexts": [
        "personal",
        "professional"
      ]
    },
    {
      "id": "DESCRIBE_APPEARANCE",
      "level": "A1-A2",
      "canDoIds": [
        "LI-A2-10"
      ],
      "label": "Describe people and appearance",
      "labelEs": "Describir personas y su apariencia",
      "skills": [
        "speaking",
        "listening",
        "interaction"
      ],
      "structures": [
        "be",
        "have",
        "adjectives",
        "adjective-noun-order"
      ],
      "vocabularyDomains": [
        "identity",
        "description"
      ],
      "contexts": [
        "personal",
        "professional"
      ]
    },
    {
      "id": "TALK_ABOUT_HEALTH",
      "level": "A2",
      "canDoIds": [
        "LI-B1-01"
      ],
      "label": "Describe simple health problems",
      "labelEs": "Describir problemas de salud sencillos",
      "skills": [
        "speaking",
        "listening",
        "interaction"
      ],
      "structures": [
        "have-got",
        "should",
        "symptom-vocabulary"
      ],
      "vocabularyDomains": [
        "health",
        "daily-life"
      ],
      "contexts": [
        "personal",
        "professional"
      ]
    },
    {
      "id": "ORDER_FOOD",
      "level": "A1-A2",
      "canDoIds": [
        "LI-B1-02"
      ],
      "label": "Order food and drinks politely",
      "labelEs": "Pedir comida y bebidas con cortesía",
      "skills": [
        "speaking",
        "listening",
        "interaction",
        "writing"
      ],
      "structures": [
        "would-like",
        "countable-uncountable",
        "polite-questions"
      ],
      "vocabularyDomains": [
        "food",
        "communication"
      ],
      "contexts": [
        "personal",
        "professional"
      ]
    },
    {
      "id": "SHOP_AND_COMPARE",
      "level": "A2",
      "canDoIds": [
        "LI-B1-03"
      ],
      "label": "Ask about products, prices and options",
      "labelEs": "Preguntar por productos, precios y opciones",
      "skills": [
        "speaking",
        "listening",
        "interaction"
      ],
      "structures": [
        "comparatives",
        "how-much-many",
        "demonstratives"
      ],
      "vocabularyDomains": [
        "shopping",
        "numbers"
      ],
      "contexts": [
        "personal",
        "professional"
      ]
    },
    {
      "id": "MAKE_PLANS",
      "level": "A2",
      "canDoIds": [
        "LI-B1-04"
      ],
      "label": "Make and respond to plans",
      "labelEs": "Proponer planes y responder",
      "skills": [
        "speaking",
        "listening",
        "interaction"
      ],
      "structures": [
        "going-to",
        "present-continuous-future",
        "time-expressions"
      ],
      "vocabularyDomains": [
        "time",
        "communication"
      ],
      "contexts": [
        "personal",
        "professional"
      ]
    },
    {
      "id": "TALK_ABOUT_WEATHER",
      "level": "A1-A2",
      "canDoIds": [
        "LI-B1-05"
      ],
      "label": "Describe the weather and seasons",
      "labelEs": "Describir el clima y las estaciones",
      "skills": [
        "speaking",
        "listening",
        "interaction",
        "writing"
      ],
      "structures": [
        "it-is",
        "weather-vocabulary",
        "comparatives"
      ],
      "vocabularyDomains": [
        "weather",
        "nature"
      ],
      "contexts": [
        "personal",
        "professional"
      ]
    },
    {
      "id": "TELL_A_STORY",
      "level": "A2-B1",
      "canDoIds": [
        "LI-B1-06"
      ],
      "label": "Tell a short story in sequence",
      "labelEs": "Contar una historia breve en secuencia",
      "skills": [
        "speaking",
        "listening",
        "interaction"
      ],
      "structures": [
        "past-simple",
        "past-continuous",
        "sequence-connectors"
      ],
      "vocabularyDomains": [
        "experiences",
        "time"
      ],
      "contexts": [
        "personal",
        "professional"
      ]
    },
    {
      "id": "REPORT_PROGRESS",
      "level": "A2-B1",
      "canDoIds": [
        "LI-B1-07"
      ],
      "label": "Report progress on a task or project",
      "labelEs": "Informar el progreso de una tarea o proyecto",
      "skills": [
        "speaking",
        "listening",
        "interaction"
      ],
      "structures": [
        "present-perfect",
        "past-simple",
        "project-vocabulary"
      ],
      "vocabularyDomains": [
        "work",
        "projects"
      ],
      "contexts": [
        "personal",
        "professional"
      ]
    },
    {
      "id": "PROPOSE_SOLUTIONS",
      "level": "B1",
      "canDoIds": [
        "RE-A2-01"
      ],
      "label": "Suggest and evaluate solutions",
      "labelEs": "Proponer y evaluar soluciones",
      "skills": [
        "speaking",
        "listening",
        "interaction"
      ],
      "structures": [
        "should-could",
        "first-conditional",
        "comparatives"
      ],
      "vocabularyDomains": [
        "thinking",
        "projects"
      ],
      "contexts": [
        "personal",
        "professional"
      ]
    },
    {
      "id": "GIVE_INSTRUCTIONS",
      "level": "A2",
      "canDoIds": [
        "RE-A2-02"
      ],
      "label": "Give clear instructions",
      "labelEs": "Dar instrucciones claras",
      "skills": [
        "speaking",
        "listening",
        "interaction"
      ],
      "structures": [
        "imperatives",
        "sequence-connectors",
        "must-should"
      ],
      "vocabularyDomains": [
        "technology",
        "education"
      ],
      "contexts": [
        "personal",